{"consumer":{"access":"nur-lesend","branch":"codex/universaarl-projekt-twin","consumerId":"project-twin","repositoryUrl":"https://github.com/sivla/FiBu.git"},"consumerBindingDigest":"sha256:d12c3efe1db69db09803112021348c2b38cccfec4f8854809b798e5c44fbd500","contractId":"UABC-PROJECT-DATA-V1","index":{"gitMode":"100644","path":"exports/project-data/v1/index.yaml","sha256":"2818836412fba746e8215c0f4ae353da01601e6268b7a9e45ed2530bd2f06e01","sizeBytes":9657},"indexPath":"exports/project-data/v1/index.yaml","payloadBundleDigest":"sha256:bf45acfce4e88c40ac08c108f8f7bd79832e2e2504934f514538f1b323ce2d73","payloadDigestFormat":"uabc-snapshot-records-v1","payloads":[{"gitMode":"100644","id":"UABC-SRC-BCB-MTG-002","path":"atlassian/confluence/meetings/UABC-MTG-001.md","selector":null,"sha256":"41a3e19eb31bae420a018a2eb082bff4119c26637bd2182df7d6a607fda2cf6e","sizeBytes":3464},{"gitMode":"100644","id":"UABC-SRC-BCB-MTG-001","path":"atlassian/confluence/meetings/index.yaml","selector":null,"sha256":"558c93db15cde32d280e2712db68f937041a7c332ac56ad425f690bd78765ee3","sizeBytes":708},{"gitMode":"100644","id":"UABC-SRC-BCB-CONF-003","path":"atlassian/confluence/pages/70-bc-basic-project.md","selector":null,"sha256":"ae069a0f5d47817fc05f171dd59de0b88f30dc1ef5a510d38cc31b5b0f8df7c3","sizeBytes":2526},{"gitMode":"100644","id":"UABC-SRC-BCB-CONF-004","path":"atlassian/confluence/pages/71-bc-basic-discovery.md","selector":null,"sha256":"f114f8b933a18970a18c645801ed77eefe6d4ef0cc17d16e84e0ff78a43b1345","sizeBytes":2081},{"gitMode":"100644","id":"UABC-SRC-BCB-CONF-005","path":"atlassian/confluence/pages/72-bc-basic-implementation.md","selector":null,"sha256":"923af6a32835aa0ee426c8bcd07ec08e3f4542336b81c8568851ace73b02fb0d","sizeBytes":1633},{"gitMode":"100644","id":"UABC-SRC-BCB-CONF-006","path":"atlassian/confluence/pages/73-bc-basic-hypercare.md","selector":null,"sha256":"2209345c56a87e0cc5a973a1384b4dbbed766e88da0aa5d280e86aa76be2bd74","sizeBytes":1978},{"gitMode":"100644","id":"UABC-SRC-BCB-CONF-007","path":"atlassian/confluence/pages/74-bc-basic-deliverables.md","selector":null,"sha256":"0b3d5e38ba3e362d340f97890f3d5fbc033668dd1a518149a7cfffab7441baf2","sizeBytes":2572},{"gitMode":"100644","id":"UABC-SRC-BCB-CONF-008","path":"atlassian/confluence/pages/75-bc-basic-meetings-decisions.md","selector":null,"sha256":"a4d331680542b141408ef2e3be6901461659795cb4cf87c2e996cf5261fa781c","sizeBytes":1462},{"gitMode":"100644","id":"UABC-SRC-BCB-JIRA-003","path":"atlassian/jira/issues/bc-basic-project.yaml","selector":null,"sha256":"0e120c520e5f0880ef5ba82ea6c4d7d7b8be1d1caac307f292e72b8d0d2e1567","sizeBytes":25220},{"gitMode":"100644","id":"UABC-SRC-BCB-JIRA-004","path":"atlassian/jira/people.yaml","selector":"people[id in P-001,P-002,P-004,P-005,P-011,P-016,P-019]","sha256":"14e41edccbe733ae0262ff56175ff88d1c03b3426dccf82f227e6e697abd9dc5","sizeBytes":2104},{"gitMode":"100644","id":"UABC-SRC-BCB-CUST-001","path":"docs/guides/beginner/business-central-basic.md","selector":null,"sha256":"17e4067a6ec6496177cc26e6135fe95a667e65b7b6621fe3f176516b93c3fce6","sizeBytes":5447},{"gitMode":"100644","id":"UABC-SRC-BCB-SOURCES-001","path":"docs/research/sources.yaml","selector":"sources[id in SRC-BC-016,SRC-BC-052,SRC-BC-053,SRC-BC-054,SRC-BC-055,SRC-BC-056,SRC-BC-057,SRC-LAW-001,SRC-ELSTER-001]","sha256":"005dd03d939596ec49371466a6fb9f6a1c84a810232bb6c94d71944f58772808","sizeBytes":18288},{"gitMode":"100644","id":"UABC-SRC-BCB-CONS-001","path":"docs/runbooks/business-central-basic.md","selector":null,"sha256":"27c852ba8a265ec76b056c73736e2668f21cf74073d47c02917f19ba76cfcc35","sizeBytes":5587},{"gitMode":"100644","id":"UABC-SRC-BCB-SPECTRA-EVIDENCE-001","path":"evidence/spectra-release-0.1.0-alpha.1.yaml","selector":null,"sha256":"d5e9cc2edd3c62d60de6c9ee82fc353986f6bfb250acd703ebda77c9fe7e9834","sizeBytes":1342},{"gitMode":"100644","id":"UABC-SRC-BCB-VER-001","path":"evidence/verification-register.yaml","selector":"verifications[changeRef=migrate-bc-basic-to-single-uabc-ticket-project]","sha256":"8a57478b4397dc13f3a8347c70801e6a6c05e53cfe45553aa4fbb8afb793ea72","sizeBytes":11761},{"gitMode":"100644","id":"UABC-SRC-BCB-SNAPSHOT-SCHEMA-001","path":"governance/schemas/project-snapshot-manifest.schema.json","selector":null,"sha256":"ce8ffa0134a6367329d5ec41dfa9ce6b7df7b859291ec9cd37b74de83ea71054","sizeBytes":4486},{"gitMode":"100644","id":"UABC-SRC-BCB-DPLAN-001","path":"openspec/changes/migrate-bc-basic-to-single-uabc-ticket-project/delivery-plan.md","selector":null,"sha256":"0b28aaa3952c7aabab1f7ee969534fbe0b9d2936ae92910e81e10aebe10a8032","sizeBytes":5970},{"gitMode":"100644","id":"UABC-SRC-BCB-DESIGN-001","path":"openspec/changes/migrate-bc-basic-to-single-uabc-ticket-project/design.md","selector":null,"sha256":"ca665feac84b254926f2f819e8ad0c169bffbf7ba73aed96ee69e6ca9c22f1d9","sizeBytes":9269},{"gitMode":"100644","id":"UABC-SRC-BCB-OPENSPEC-001","path":"openspec/changes/migrate-bc-basic-to-single-uabc-ticket-project/proposal.md","selector":null,"sha256":"3cb66a2fbfd20918d0bee3212007723e8da43968352b71bcf9dc94f63ceb7c67","sizeBytes":8280},{"gitMode":"100644","id":"UABC-SRC-BCB-SPEC-001","path":"openspec/changes/migrate-bc-basic-to-single-uabc-ticket-project/specs/bc-basic-delivery/spec.md","selector":null,"sha256":"fb08cb477e3204567ea83e6033244dcd417daaf7b513b7c00a62febe7c4ca4eb","sizeBytes":16630},{"gitMode":"100644","id":"UABC-SRC-BCB-TASKS-001","path":"openspec/changes/migrate-bc-basic-to-single-uabc-ticket-project/tasks.md","selector":null,"sha256":"0b1e2296878cfb7e45f27b08eff134c0e7d7a560521d9157b7fc79aa14235557","sizeBytes":3750},{"gitMode":"100644","id":"UABC-SRC-BCB-VPLAN-001","path":"openspec/changes/migrate-bc-basic-to-single-uabc-ticket-project/verification.md","selector":null,"sha256":"e1d6ea9037105d5b780152c61deea586c6c6851e28daf5a299e7f1fda452df1b","sizeBytes":4067},{"gitMode":"100644","id":"UABC-SRC-BCB-PW-001","path":"playwright/scenarios/bc-basic-e2e.yaml","selector":null,"sha256":"5c27b90b720782f65b16136b2b1c796a644fc44726fcaea4633cb106e38d9917","sizeBytes":4508},{"gitMode":"100644","id":"UABC-SRC-BCB-BILL-001","path":"project/bc-basic/billing.yaml","selector":null,"sha256":"2d4a2bda501c284de630dafe9ce30a36584c11d1d2171094fe15884cf0d60c86","sizeBytes":2511},{"gitMode":"100644","id":"UABC-SRC-BCB-DATA-BLANK-001","path":"project/bc-basic/customer-templates/blank/company-setup.blank.yaml","selector":null,"sha256":"e1970177fa31c0abbb55e5505a896861eba53197921f17bf629269d358aa7685","sizeBytes":2105},{"gitMode":"100644","id":"UABC-SRC-BCB-DATA-BLANK-003","path":"project/bc-basic/customer-templates/blank/customers.blank.csv","selector":null,"sha256":"61a6e92f84fc3f0acdc3d9df0e5806d98746da860f3a8ffd6ddb93f65e7f4ae7","sizeBytes":203},{"gitMode":"100644","id":"UABC-SRC-BCB-DATA-BLANK-002","path":"project/bc-basic/customer-templates/blank/dimensions.blank.csv","selector":null,"sha256":"806e99c57a97d37cfe6139fade95458d74e7c48ec4df406a10be4db6b344c6e6","sizeBytes":54},{"gitMode":"100644","id":"UABC-SRC-BCB-DATA-BLANK-007","path":"project/bc-basic/customer-templates/blank/gl-opening.blank.csv","selector":null,"sha256":"de48b6f7a5a643d4e3c5bdcd703144978e5156b223167f954286be7d437bcefd","sizeBytes":124},{"gitMode":"100644","id":"UABC-SRC-BCB-DATA-BLANK-006","path":"project/bc-basic/customer-templates/blank/inventory-opening.blank.csv","selector":null,"sha256":"e55ba8677129799fc48807e3d3831205a753d693e1fc6de4e1442f3470ac3023","sizeBytes":102},{"gitMode":"100644","id":"UABC-SRC-BCB-DATA-BLANK-005","path":"project/bc-basic/customer-templates/blank/items.blank.csv","selector":null,"sha256":"d412a86e3a8fe64a45cb8740107b09efaff117a3310a40e0139f868111badea4","sizeBytes":218},{"gitMode":"100644","id":"UABC-SRC-BCB-DATA-BLANK-008","path":"project/bc-basic/customer-templates/blank/open-customer-vendor-entries.blank.csv","selector":null,"sha256":"dce9e947c376c8d172c19dc8f1874031c8e15264b8bae7bf5ec764a85db29fe4","sizeBytes":116},{"gitMode":"100644","id":"UABC-SRC-BCB-DATA-BLANK-004","path":"project/bc-basic/customer-templates/blank/vendors.blank.csv","selector":null,"sha256":"e7fc773698ebc079d532441940dfba266dce913f5b7d239c0385773a94d4be78","sizeBytes":199},{"gitMode":"100644","id":"UABC-SRC-BCB-DATA-EXAMPLE-001","path":"project/bc-basic/customer-templates/example/company-setup.example.yaml","selector":null,"sha256":"cda1f22b8022f6db71d6e5d5a19140801388908a7a5a7a71dcaa02ea31a07b3d","sizeBytes":467},{"gitMode":"100644","id":"UABC-SRC-BCB-DATA-EXAMPLE-003","path":"project/bc-basic/customer-templates/example/customers.example.csv","selector":null,"sha256":"f1421e1d592fd9bbc73bf640813fe59583da21db0539ecf5fa0413a4e1450c4b","sizeBytes":287},{"gitMode":"100644","id":"UABC-SRC-BCB-DATA-EXAMPLE-002","path":"project/bc-basic/customer-templates/example/dimensions.example.csv","selector":null,"sha256":"e563b869436405582bd79b0264f0a819a56c42889cbd81d8f06f6f95378aa2e6","sizeBytes":187},{"gitMode":"100644","id":"UABC-SRC-BCB-DATA-EXAMPLE-007","path":"project/bc-basic/customer-templates/example/gl-opening.example.csv","selector":null,"sha256":"8f7367397486b06d5dcaf9c621c40e53056fd8c0a1b5530c914b3fc53f30dfc5","sizeBytes":554},{"gitMode":"100644","id":"UABC-SRC-BCB-DATA-EXAMPLE-006","path":"project/bc-basic/customer-templates/example/inventory-opening.example.csv","selector":null,"sha256":"012040c6b391495ddb55ca12d8e5e321d8a9522f5ac2d020bbda5bb9015cbc0e","sizeBytes":180},{"gitMode":"100644","id":"UABC-SRC-BCB-DATA-EXAMPLE-005","path":"project/bc-basic/customer-templates/example/items.example.csv","selector":null,"sha256":"5aab76ac2b57e18e74719070718c98182eaeda15acab1edbc494cac62ad08c84","sizeBytes":316},{"gitMode":"100644","id":"UABC-SRC-BCB-DATA-EXAMPLE-008","path":"project/bc-basic/customer-templates/example/open-customer-vendor-entries.example.csv","selector":null,"sha256":"a4d1a104edc219feb49544c6287e68a4789cb7a661244da48184e67d831d6b86","sizeBytes":296},{"gitMode":"100644","id":"UABC-SRC-BCB-DATA-EXAMPLE-004","path":"project/bc-basic/customer-templates/example/vendors.exampl